Faculty_Full_Name,Rank,Professor Type,Faculty,Faculty_Author,Faculty_Author_Affiliation,pmids,pub_mesh_terms
"Schilling, Thomas",prof,research,"Schilling, Thomas","Schilling, Thomas[Author]","Schilling, Thomas[Author] AND Irvine[Affiliation]","['40145570', '39868081', '39787221', '39575928', '39330988', '38975838', '37497608', '37039156', '36561564', '36377462', '36001035', '35171678']","Animals; Zebrafish; Tendons; Gene Expression Profiling; Muscle Contraction; Mechanotransduction, Cellular; Fibroblasts; Gene Expression Regulation, Developmental; Embryo, Nonmammalian; Tenocytes; Zebrafish Proteins; Transcriptome; Animals; Humans; Mice; Adipocytes; Biomechanical Phenomena; Cartilage; Extracellular Matrix; Lipid Droplets; Lipid Metabolism; Lipogenesis; Obesity; Vacuoles; Animals; Zebrafish; Sex Determination Processes; Germ Cells; Cell Proliferation; Male; Female; Zebrafish Proteins; Receptors, Retinoic Acid; Tretinoin; Gonads; Animals, Genetically Modified; Gene Expression Regulation, Developmental; Mutation; Animals; Zebrafish; Aquaporins; Lens, Crystalline; Eye Proteins; Water; Permeability; Zebrafish Proteins; Calcium; Gene Expression Regulation, Developmental; Animals, Genetically Modified; Zebrafish; Animals; Cohesins; Cell Cycle Proteins; Chromosomal Proteins, Non-Histone; Zebrafish Proteins; Mutation; Gene Expression Regulation, Developmental; Wnt Signaling Pathway; Embryonic Development; Gene Dosage; Mesoderm; Animals; Zebrafish; Tendons; Bone and Bones; Signal Transduction; Ligaments; Animals; Bone and Bones; Cartilage; Cell Polarity; Chondrocytes; Morphogenesis; Receptor Tyrosine Kinase-like Orphan Receptors; Receptors, Wnt; Wnt Proteins; Wnt Signaling Pathway; Zebrafish; Zebrafish Proteins; Humans; Mice; Animals; Chondrocytes; Zebrafish; Cartilage; Growth Plate; Skull; Mammals; Animals; Vertebrates; Jaw; Regulatory Sequences, Nucleic Acid; Biological Evolution; Animals; Cichlids; Lakes; Malawi; Species Specificity; Mammals; Animals; Aquaporins; Eye Proteins; Lens, Crystalline; Water; Zebrafish"
"Shi, Xiaoyu",asst prof,research,"Shi, Xiaoyu","Shi, Xiaoyu[Author]","Shi, Xiaoyu[Author] AND Irvine[Affiliation]","['39814881', '39798570', '39105364', '38948754', '38265180', '38045269', '38014020', '37856018', '37253290', '36314803']","Animals; Mice; Endocytosis; Long-Term Potentiation; Receptors, AMPA; Synapses; Male; Acyltransferases; Memory Disorders; Peptides; Memory; Pinocytosis; Protein Kinase C; Hippocampus; Brain Injuries; Mice, Inbred C57BL; Humans; Humans; RNA Precursors; HeLa Cells; RNA Splicing; Cell Nucleus; RNA Polymerase II; RNA 3' End Processing; RNA, Messenger; HEK293 Cells; Protein Binding; Intrinsically Disordered Proteins; RNA Processing, Post-Transcriptional; Gene Expression Regulation; RNA-Binding Proteins; Humans; Proteomics; Staining and Labeling; Protein Interaction Mapping; Microscopy; Proteins; Humans; Microscopy; Antibodies; Coloring Agents; Health Personnel; Hydrogels; Microscopy, Fluorescence; Proteins; Hydrogels; Microscopy, Fluorescence; Single Molecule Imaging; Microscopy, Fluorescence; Staining and Labeling; Hydrogels"
"Sorte, Cascade",prof,research,"Sorte, Cascade","Sorte, Cascade[Author]","Sorte, Cascade[Author] AND Irvine[Affiliation]","['38600085', '37546568', '37260224', '36806368', '35972940', '35622892', '35257208', '35039551']",Biodiversity; Conservation of Natural Resources; Ecosystem; Europe; Introduced Species; Nitrogen; Animals; Ecosystem; Carbon Dioxide; Alaska; Oxygen; Hydrogen-Ion Concentration; Humans; Ecosystem; Biodiversity; Introduced Species; Plants; Geography; Biodiversity; Ecosystem; Human Activities; Humans; Introduced Species; Anthropogenic Effects; Climate Change; Ecosystem; Humans; Introduced Species; Temperature; Animals; Climate Change; Ecosystem; Gastropoda; Predatory Behavior; Species Specificity
"Stark, Craig",prof,research,"Stark, Craig","Stark, Craig[Author]","Stark, Craig[Author] AND Irvine[Affiliation]","['40233872', '40093240', '39974878', '39763904', '39547056', '39450914', '39450487', '39268219', '39239893', '39239892', '39055313', '39055052', '38826456', '38561226', '38559159', '38527084', '38481469', '37908438', '37526119', '37423487']","Animals; Dogs; Alzheimer Disease; NFATC Transcription Factors; Disease Models, Animal; Cognition; Calcineurin Inhibitors; Tacrolimus; Calcineurin; Aging; Male; Female; Spatial Learning; Memory; Cognitive Dysfunction; Hippocampus; Humans; Magnetic Resonance Imaging; Quality Control; Image Processing, Computer-Assisted; Reproducibility of Results; Neuroimaging; Humans; Aged; Female; Male; Magnetic Resonance Imaging; Aging; Temporal Lobe; Hippocampus; Aged, 80 and over; Middle Aged; Cognitive Dysfunction; Image Processing, Computer-Assisted; Atlases as Topic; Atrophy; Entorhinal Cortex; Mental Status and Dementia Tests; Adult; Aged; Humans; Male; Middle Aged; Young Adult; Alzheimer Disease; Amyloid beta-Peptides; Benchmarking; Biomarkers; Cognition; Memory; Models, Biological; tau Proteins; Female; Humans; Alzheimer Disease; Cognitive Dysfunction; Female; Male; tau Proteins; Aged; Positron-Emission Tomography; Biomarkers; Amyloid beta-Peptides; Disease Progression; Neuropsychological Tests; Aged, 80 and over; Animals; Dogs; Female; Atrophy; Male; Aging; Brain; Tacrolimus; Behavior, Animal; Magnetic Resonance Imaging; Humans; Magnetic Resonance Imaging; Male; Female; Young Adult; Adult; Brain Mapping; Learning; Reading; Verbal Learning; Oxygen; Hippocampus; Cerebral Cortex; Pattern Recognition, Visual; Humans; Rats; Animals; Aged; Hippocampus; Aging; Magnetic Resonance Imaging; Memory; Gray Matter; Magnetic Resonance Spectroscopy; Brain; Software; Algorithms; Reference Standards; Protons"
"Striedter, Georg",prof,research,"Striedter, Georg","Striedter, Georg[Author]","Striedter, Georg[Author] AND Irvine[Affiliation]",[],
"Suetterlin, Christine",prof,research,"Suetterlin, Christine","Suetterlin, Christine[Author]","Suetterlin, Christine[Author] AND Irvine[Affiliation] OR 0000-0003-1354-507X[Author - Identifier]","['39670716', '38885287', '35726915', '35703434']","Chlamydia trachomatis; Humans; Bacterial Proteins; Gene Knockdown Techniques; HeLa Cells; Membrane Proteins; Sorting Nexins; Gene Expression Regulation, Bacterial; Chlamydia trachomatis; Cilia; Chlamydia Infections; Humans; Epithelial Cells; Chlamydia trachomatis; Escherichia coli; Gene Expression Regulation, Bacterial; RNA, Messenger; RNA, Small Untranslated; Reverse Genetics; AMP-Activated Protein Kinases; Bacterial Proteins; Chlamydia; Chlamydia Infections; Chlamydia trachomatis; Humans; Lipids; Proto-Oncogene Proteins c-akt"
"Sumikawa, Katumi",prof,research,"Sumikawa, Katumi","Sumikawa, Katumi[Author]","Sumikawa, Katumi[Author] AND Irvine[Affiliation]","['39522675', '36029955']","Animals; Prefrontal Cortex; Receptor, Muscarinic M1; Nicotine; Male; Hippocampus; Female; Pyramidal Cells; Allosteric Regulation; N-Methylaspartate; Rats, Sprague-Dawley; Nicotinic Agonists; Rats; Interneurons; Long-Term Potentiation; Receptors, N-Methyl-D-Aspartate; CA1 Region, Hippocampal; Quinolines; Animals; Female; Hippocampus; Long-Term Potentiation; Mice; Mice, Inbred C57BL; Mice, Knockout; Nicotine; Nicotinic Agonists; Pregnancy; Receptors, Nicotinic"
"Sun, Sha",assoc prof,research,"Sun, Sha","Sun, Sha[Author]","Sun, Sha[Author] AND Irvine[Affiliation]","['39546568', '39001870', '38352866', '38095719', '35967418', '35039434']","RNA, Long Noncoding; Female; Humans; Ovarian Neoplasms; Neoplastic Stem Cells; Cell Plasticity; Cell Line, Tumor; Gene Expression Regulation, Neoplastic; Animals; Female; Male; Alleles; Drosophila melanogaster; Drosophila Proteins; Gene Frequency; Genes, X-Linked; Genetic Fitness; Genetic Linkage; Models, Genetic; Selection, Genetic; X Chromosome; Homeodomain Proteins; Animals; Female; Humans; Mice; Glomerulonephritis; Kidney; Mice, Inbred MRL lpr; Proteinuria; Toll-Like Receptor 5; Humans; RNA, Long Noncoding; Sex Characteristics; Neoplasms; Female; Male; Epigenesis, Genetic; Animals; Gene Expression Regulation, Neoplastic; Sex Chromosomes; Animals; Dysbiosis; Lactobacillus; Lymphadenopathy; Mice; Mice, Inbred MRL lpr; Splenomegaly; Animals; Disease Models, Animal; Female; Gastrointestinal Microbiome; Kidney; Lupus Nephritis; Male; Mice; Mice, Inbred MRL lpr; MicroRNAs; RNA, Ribosomal, 16S; Spleen"
"Swarup, Vivek",assoc prof,research,"Swarup, Vivek","Swarup, Vivek[Author]","Swarup, Vivek[Author] AND Irvine[Affiliation]","['40060680', '40015966', '39988890', '39844286', '39809279', '39578645', '39484433', '39282421', '39053462', '38907165', '38895362', '38869276', '38616896', '38534018', '38489267', '38460121', '38426371', '37546983', '37426759', '37277179']","Animals; Brain; Mice; Transcriptome; Postmortem Changes; Tauopathies; Mice, Transgenic; Mice, Inbred C57BL; Male; Disease Models, Animal; Time Factors; Neurons; Female; Animals; Microglia; Integrases; Mice; Mice, Transgenic; Alzheimer Disease; Disease Models, Animal; Brain; Mice, Inbred C57BL; Plaque, Amyloid; Male; Female; Animals; Microglia; Mice; Alzheimer Disease; Plaque, Amyloid; tau Proteins; Mice, Transgenic; Disease Models, Animal; Tauopathies; Brain; Apolipoproteins E; Humans; Animals; Mice; Humans; Spinal Cord Injuries; Wound Healing; Myeloid Cells; Spinal Cord; Aging; Female; Mice, Inbred C57BL; Killer Cells, Natural; Male; Natural Killer T-Cells; CD8-Positive T-Lymphocytes; Alzheimer Disease; Animals; Humans; Down Syndrome; Transcriptome; Mice; Female; Gene Expression Profiling; Disease Models, Animal; Male; Cell Nucleus; Aged; Gene Regulatory Networks; Aged, 80 and over; Cell Communication; Animals; Immunity, Innate; Mice; Aging; Remyelination; Microglia; Myeloid Cells; Central Nervous System; Mice, Inbred C57BL; Myelin Sheath; Epigenesis, Genetic; Demyelinating Diseases; Disease Models, Animal; Animals; Astrocytes; Spinal Cord Injuries; Mice; Male; Wound Healing; Female; Stroke; Mice, Inbred C57BL; Cellular Reprogramming; Oligodendrocyte Precursor Cells; Cell Proliferation; MicroRNAs; Encephalitis Virus, Japanese; Microglia; Fatty Acids, Volatile; Mice; Animals; Inflammation; Encephalitis, Japanese; Cell Line; Transcription Factors; NF-KappaB Inhibitor alpha; NF-kappa B; Signal Transduction; Humans; Alzheimer Disease; Humans; Systems Biology; Gene Regulatory Networks; Epigenomics; Genomics; Brain; Multiomics; Mice; Animals; Habenula; Cocaine; Memory; Gene Expression Regulation; Recurrence; Animals; Mice; Alzheimer Disease; Amyloid beta-Peptides; Disease Models, Animal; Mice, Transgenic; Neuroglia; Plaque, Amyloid; Humans; Mice; Humans; Female; Animals; Alzheimer Disease; Plaque, Amyloid; Resilience, Psychological; Mice, Inbred C57BL; Microglia; Genetic Variation; Disease Models, Animal; Mice, Transgenic; Amyloid beta-Peptides; Humans; Transcriptome; Autism Spectrum Disorder; Gene Expression Profiling; Gene Regulatory Networks; Alzheimer Disease; Rats; Humans; Male; Animals; Axons; Integrins; Nerve Regeneration; Rats, Sprague-Dawley; Spinal Cord; Spinal Cord Injuries; Ganglia, Spinal; Sensory Receptor Cells"
"Symons, Celia",asst prof,research,"Symons, Celia","Symons, Celia[Author]","Symons, Celia[Author] AND Irvine[Affiliation]","['40198102', '38840430', '38273540', '38273537', '36930600', '36707927', '35315562', '35193976']","Ecosystem; Biodiversity; Conservation of Natural Resources; Humans; Climate Change; Lakes; Wildfires; Smoke; Ecosystem; North America; Environmental Monitoring; Ecosystem; Carbon Dioxide; Fires; Forests; Wildfires; Ponds; Biomass; Dissolved Organic Matter; Fresh Water; Organic Chemicals; Ecosystem; Models, Biological; Time Factors; Temperature; Population Dynamics; Ecology; Animals; Plankton; Seasons; Lakes; Time Factors; Phytoplankton; Zooplankton; Ecosystem; Animals; Antelopes; Bacteria; Ecosystem; Animals; Anthropogenic Effects; Ecosystem; Europe; Guidelines as Topic; Lakes; North America; Salinity; Water Quality; Zooplankton"
"Tenner, Andrea",prof,research,"Tenner, Andrea","Tenner, Andrea[Author]","Tenner, Andrea[Author] AND Irvine[Affiliation]","['40128350', '39844286', '39653749', '39147742', '38895362', '38572865', '38506634', '38460121', '38426371', '38278523', '37873302', '37726739', '37662399', '36803190', '36750318', '36462718', '35978440', '35820938', '35140584']","Animals; Microglia; Mice; Alzheimer Disease; Plaque, Amyloid; tau Proteins; Mice, Transgenic; Disease Models, Animal; Tauopathies; Brain; Apolipoproteins E; Humans; Humans; Alzheimer Disease; Animals; Neuroinflammatory Diseases; Inflammation; Immunity, Innate; Animals; Receptor, Anaphylatoxin C5a; Alzheimer Disease; Disease Models, Animal; Mice; Female; Male; Signal Transduction; Microglia; Hippocampus; Neuroglia; Astrocytes; Mice, Transgenic; Humans; Mice, Inbred C57BL; Animals; Female; Humans; Male; Mice; Alzheimer Disease; Amyloid beta-Peptides; Disease Models, Animal; Gastrointestinal Microbiome; Gene Knock-In Techniques; Genotype; Metabolomics; Mice, Transgenic; Microbiota; Sex Characteristics; Animals; Mice; ATP-Binding Cassette Transporters; Plaque, Amyloid; Amyloid beta-Peptides; Alzheimer Disease; Mice, Transgenic; Neurons; Disease Models, Animal; Humans; Brain; Microglia; Phagocytosis; Amyloid beta-Protein Precursor; Animals; Mice; Alzheimer Disease; Amyloid beta-Peptides; Disease Models, Animal; Mice, Transgenic; Neuroglia; Plaque, Amyloid; Humans; Mice; Humans; Female; Animals; Alzheimer Disease; Plaque, Amyloid; Resilience, Psychological; Mice, Inbred C57BL; Microglia; Genetic Variation; Disease Models, Animal; Mice, Transgenic; Amyloid beta-Peptides; Mice; Animals; Humans; Alzheimer Disease; Synapses; Long-Term Potentiation; Disease Models, Animal; Animals; Mice; Alzheimer Disease; Complement C1q; Disease Models, Animal; Gastrointestinal Microbiome; Neurodegenerative Diseases; Neuroinflammatory Diseases; Receptors, Complement; Mice; Animals; Alzheimer Disease; Cuprizone; RNA Splicing; Mutation; Plaque, Amyloid; Disease Models, Animal; Demyelinating Diseases; Microglia; Brain; Membrane Glycoproteins; Receptors, Immunologic; Humans; Animals; Neuroinflammatory Diseases; Neuroprotection; Brain; Complement System Proteins; Neuronal Plasticity; Microglia; Mice; Animals; Alzheimer Disease; Calcium; Mice, Transgenic; Neurons; Memory Disorders; Hippocampus; Disease Models, Animal; Alzheimer Disease; Animals; Disease Models, Animal; Disease Progression; Mice; Microglia; Neurodegenerative Diseases; Receptor, Anaphylatoxin C5a; Alzheimer Disease; Animals; Biological Phenomena; Mice; Microglia; Plaque, Amyloid; Receptor, Anaphylatoxin C5a; Signal Transduction"
"Thompson-Peer, Katherine",asst prof,research,"Thompson-Peer, Katherine","Thompson-Peer, Katherine[Author]","Thompson-Peer, Katherine[Author] AND Irvine[Affiliation]","['39433621', '38825174', '36547263']","Animals; Dendrites; Neurodegenerative Diseases; Disease Models, Animal; Neuroprotection; Drosophila; Drosophila melanogaster; Peptides; Neurons; Dendrites; Animals; Calcium; Nerve Regeneration; Humans; Mice; Potassium Channels, Inwardly Rectifying; Mice, Transgenic; Humans; Integrins; Endothelial Cells; Huntington Disease; Neuroglia; Blood-Brain Barrier; Extracellular Matrix"
"Thompson, Leslie",prof,research,"Thompson, Leslie","Thompson, Leslie[Author]","Thompson, Leslie[Author] AND Irvine[Affiliation]","['40258535', '40089066', '39809899', '39762660', '39391934', '39331414', '39307401', '39282421', '39074279', '39005258', '38968054', '38872308', '38697975', '38608784', '37863037', '37807512', '36864071', '36764301', '36754966', '36631473']","Humans; Quantitative Trait Loci; Brain; Gene Expression Regulation; Tandem Repeat Sequences; Amyotrophic Lateral Sclerosis; Phenotype; Alzheimer Disease; Genetic Variation; Male; C9orf72 Protein; Female; Multiomics; Huntington Disease; Animals; Humans; DNA-Binding Proteins; Mice; Huntingtin Protein; Methyltransferases; Alternative Splicing; Mice, Transgenic; RNA Splicing; Brain; Adenosine; Male; RNA Methylation; Animals; Huntington Disease; Sumoylation; Mice, Transgenic; Mice; Corpus Striatum; Huntingtin Protein; Neurons; Disease Models, Animal; Cells, Cultured; Receptors, Metabotropic Glutamate; Male; Humans; Huntington Disease; Huntingtin Protein; Poly Adenosine Diphosphate Ribose; Signal Transduction; DNA Damage; Neurons; Induced Pluripotent Stem Cells; Fibroblasts; DNA Repair; Humans; Induced Pluripotent Stem Cells; Ataxin-1; Spinocerebellar Ataxias; Motor Neurons; Calcium Signaling; Cell Differentiation; Transcription, Genetic; Huntingtin Protein; Lysosomes; RNA-Binding Proteins; Humans; Ubiquitin; Mitochondria; Autophagy; Animals; Mitochondrial Proteins; Mice; Protein Binding; Huntington Disease; Peptides; Huntington Disease; Terminology as Topic; Humans; Biomedical Research; Amyotrophic Lateral Sclerosis; Humans; Chromatin; Promoter Regions, Genetic; Algorithms; Gene Expression Regulation; Chromatin Immunoprecipitation Sequencing; Histones; Humans; Amyotrophic Lateral Sclerosis; Induced Pluripotent Stem Cells; Motor Neurons; Male; Female; Middle Aged; Case-Control Studies; Chromatin; Aged; Epigenomics; Chromatin Immunoprecipitation Sequencing; Disease Progression; Epigenesis, Genetic; Animals; Huntington Disease; Brain-Derived Neurotrophic Factor; Disease Models, Animal; Synapses; Cerebral Cortex; Mice; Neurons; Mice, Transgenic; Cells, Cultured; Synapsins; Huntingtin Protein; Mice, Inbred C57BL; Humans; Huntington Disease; Spinocerebellar Ataxias; Ataxin-1; Proteins; Trinucleotide Repeats; Nervous System Diseases; Genetic Association Studies; Trinucleotide Repeat Expansion; Humans; Mice; Animals; Huntington Disease; Corpus Striatum; Neural Stem Cells; Neurons; Phenotype; Disease Models, Animal; Mice, Transgenic; Huntingtin Protein; Humans; Amyotrophic Lateral Sclerosis; Induced Pluripotent Stem Cells; Motor Neurons; Cell Differentiation; Animals; Mice; Artificial Intelligence; Disease Models, Animal; Huntingtin Protein; Huntington Disease; Induced Pluripotent Stem Cells; Mitochondria; Neurons; Phenotype; Proteomics; Humans; Humans; Induced Pluripotent Stem Cells; Motor Neurons; Pluripotent Stem Cells; Proteome; Proteomics"
"Thornton, Kevin",prof,research,"Thornton, Kevin","Thornton, Kevin[Author]","Thornton, Kevin[Author] AND Irvine[Affiliation]","['37450583', '36173327']","Humans; Female; Male; Uncertainty; Mutation; Alleles; Genetics, Population; Software; Demography"
"Tinoco, Roberto",assoc prof,research,"Tinoco, Roberto","Tinoco, Roberto[Author]","Tinoco, Roberto[Author] AND Irvine[Affiliation]","['39912665', '39846843', '37704621', '37039663', '35774790', '35474500', '35303066']","Programmed Cell Death 1 Receptor; CD8-Positive T-Lymphocytes; Animals; Membrane Glycoproteins; Mice; Lymphocytic Choriomeningitis; Lymphocytic choriomeningitis virus; Mice, Knockout; Mice, Inbred C57BL; Chronic Disease; Persistent Infection; T-Cell Exhaustion; Animals; Lymphocytic choriomeningitis virus; Mice; CD8-Positive T-Lymphocytes; Prion Proteins; Cell Differentiation; Lymphocytic Choriomeningitis; Mice, Knockout; Mice, Inbred C57BL; Immunologic Memory; Lymphocyte Activation; Disease Models, Animal; PrPC Proteins; Humans; CD8-Positive T-Lymphocytes; HMGB2 Protein; Persistent Infection; Cell Differentiation; Virus Diseases; Neoplasms; CD8-Positive T-Lymphocytes; Cell Differentiation; Lymphocytic Choriomeningitis; Lymphocytic choriomeningitis virus; Persistent Infection; Animals; Mice; Cell Survival; Up-Regulation; Cell Proliferation; CD8-Positive T-Lymphocytes; Hepatitis A Virus Cellular Receptor 2; Humans; Immune Checkpoint Inhibitors; Lymphocytic Choriomeningitis; Lymphocytic choriomeningitis virus; Membrane Glycoproteins; Programmed Cell Death 1 Receptor; Diet; Humans; Immunotherapy; Melanoma; Microbiota; Skin Neoplasms; Animals; Cell Line, Tumor; Humans; Immune Checkpoint Inhibitors; Melanoma; Membrane Glycoproteins; Mice; Mice, Inbred C57BL; Programmed Cell Death 1 Receptor"
"Treseder, Kathleen",prof,research,"Treseder, Kathleen","Treseder, Kathleen[Author]","Treseder, Kathleen[Author] AND Irvine[Affiliation]","['40262767', '38740930', '38605488', '38059856', '37798477', '37104243', '36965002', '36763634']","Soil Microbiology; Bacteria; Anti-Bacterial Agents; Drug Resistance, Bacterial; Alaska; Transcription, Genetic; Genome, Bacterial; Genes, Bacterial; Temperature; Global Warming; Transcriptome; Metagenomics; Bacteria; Metagenome; Microbiota; Uncertainty; Mycorrhizae; Soil; Carbon; Nitrogen; Ecosystem; Soil; Mycorrhizae; Soil Microbiology; Climate Change; Fungi; Life History Traits; Soil; Soil Microbiology; Ecosystem; Bacteria; Animals; United States; Humans; West Nile virus; West Nile Fever; Incidence; Canada; Cold Temperature; Animals; Arthropods; Ecosystem; Songbirds; Ants; Biomass; Lepidoptera"
"Tsai, Shiou-Chuan",prof,research,"Tsai, Shiou-Chuan","Tsai, Shiou-Chuan[Author]","Tsai, Shiou-Chuan[Author] AND Irvine[Affiliation]",[],
"Walsh, Craig",prof,research,"Walsh, Craig","Walsh, Craig[Author]","Walsh, Craig[Author] AND Irvine[Affiliation]","['37538042', '37352687', '37083696', '35615699']","Mice; Animals; Fluticasone; Transplantation, Homologous; Hematopoietic Stem Cell Transplantation; Graft vs Host Disease; Immunosuppressive Agents; Mice; Animals; Microglia; Murine hepatitis virus; Remyelination; Neuroinflammatory Diseases; White Matter; Demyelinating Diseases; Coronavirus Infections; Mice, Inbred C57BL; Humans; Mice; Animals; T-Lymphocytes, Regulatory; CD4-Positive T-Lymphocytes; Multiple Sclerosis; Lymphocyte Activation; Neural Stem Cells; Forkhead Transcription Factors; CD4 Antigens"
"Wang, Wenqi",assoc prof,research,"Wang, Wenqi","Wang, Wenqi[Author]","Wang, Wenqi[Author] AND Irvine[Affiliation]","['39920630', '39658552', '39572544', '38612874', '38319785', '37937799', '37595580', '37423592', '37130167', '37080959', '37073568', '36971347', '36795754', '36682002', '36376293', '36300003', '36191197', '36129980', '39872111', '36068349']","Humans; Hippo Signaling Pathway; Protein Serine-Threonine Kinases; DNA-Binding Proteins; Transcription Factors; Drug Resistance, Neoplasm; Transcription Factor MTF-1; Lung Neoplasms; Mice; Animals; Cell Line, Tumor; Signal Transduction; Adenocarcinoma of Lung; Metals, Heavy; Tumor Suppressor Proteins; Phosphorylation; Antineoplastic Agents; Xenograft Model Antitumor Assays; Platinum Compounds; Female; Gene Expression Regulation, Neoplastic; Humans; Protein Serine-Threonine Kinases; Hippo Signaling Pathway; Neoplasms; Signal Transduction; Mutation, Missense; Neurofibromin 2; Loss of Function Mutation; Cell Line, Tumor; Animals; Head and Neck Neoplasms; Mutation; Mice; Adaptor Proteins, Signal Transducing; Phosphoric Monoester Hydrolases; Hippo Signaling Pathway; Genes, Regulator; Signal Transduction; Transcription Factors; Neoplasms; Autophagy-Related Protein 8 Family; Phosphorylation; Pyridines; Autophagy; Humans; Hippo Signaling Pathway; Autophagy; Protein Serine-Threonine Kinases; Intracellular Signaling Peptides and Proteins; Adaptor Proteins, Signal Transducing; AMP-Activated Protein Kinases; Transcription Factors; Microtubule-Associated Proteins; Phosphoric Monoester Hydrolases; Head and Neck Neoplasms; Serine; Serine-Threonine Kinase 3; Calmodulin-Binding Proteins; Animals; Mice; Cell Survival; Hippo Signaling Pathway; Autophagy; Organ Size; N-Myc Proto-Oncogene Protein; Gene Regulatory Networks; Endoderm; Cell Differentiation; Transcription Factors; Gene Expression Regulation, Developmental; Humans; Adaptor Proteins, Signal Transducing; Signal Transduction; Transcription Factors; Inflammation; Immunity, Innate; Humans; Cell Line, Tumor; Cell Proliferation; Hippo Signaling Pathway; RNA, Long Noncoding; Signal Transduction; Transcription Factors; Humans; Hippo Signaling Pathway; Protein Serine-Threonine Kinases; Signal Transduction; Drosophila Proteins; Neoplasms; Histones; Histone Deacetylase 1; Chromatin; Blastocyst; Histone Deacetylases; Embryonic Development; Acetylation; Histone Deacetylase 2; Humans; Female; RNA, Long Noncoding; Ubiquitination; Ubiquitin-Protein Ligases; Lung Neoplasms; Breast Neoplasms; Receptor, Notch1; Protein Interaction Maps; Proteomics; Proteins; Signal Transduction; Mass Spectrometry; Protein Interaction Mapping; Animals; Humans; Mice; B7-H1 Antigen; Glycosylation; Immunotherapy; Neoplasms; Tumor Escape; Tumor Suppressor Proteins; Ubiquitin-Protein Ligases; Ubiquitination; Dynactin Complex; Dyneins; Glycogen Synthase Kinase 3 beta; Kinesins; Microtubule-Associated Proteins; Microtubules; Organelles"
"Warrior, Rahul",prof,research,"Warrior, Rahul","Warrior, Rahul[Author]","Warrior, Rahul[Author] AND Irvine[Affiliation]",['35027733'],"Cadmium; Cell Line, Tumor; DNA-Binding Proteins; Gene Expression Regulation; HEK293 Cells; HeLa Cells; Hippo Signaling Pathway; Homeostasis; Humans; Inactivation, Metabolic; Phosphorylation; Protein Serine-Threonine Kinases; Stress, Physiological; Transcription Factors; Transcription, Genetic; Tumor Suppressor Proteins; Zinc; Transcription Factor MTF-1"
