Faculty_Full_Name,Rank,Professor Type,Faculty,Faculty_Author,Faculty_Author_Affiliation,pmids,pub_mesh_terms
"Allison, Steven",prof,research,"Allison, Steven","Allison, Steven[Author]","Allison, Steven[Author] AND Irvine[Affiliation]","['39726151', '39700081', '39495619', '39474635', '39412476', '39271672', '39095861', '38899583', '38865466', '38740930', '38572990', '38562029', '38550692', '38380597', '38087814', '37798477', '37138640', '37059647', '36965002', '36579433']","Soil; United States; Carbon; Nitrogen; Soil Microbiology; Nitrification; Forests; Biomass; Humans; Curriculum; Education, Graduate; Conservation of Natural Resources; Program Evaluation; Coral Reefs; Droughts; Soil Microbiology; Bacteria; Ecosystem; Plant Leaves; Metagenome; Stress, Physiological; Soil; Drought Resistance; Ecosystem; Stress, Physiological; Microbial Interactions; Climate Change; Models, Biological; Climate Change; Soil Microbiology; Biological Evolution; Adaptation, Physiological; Models, Biological; Ecosystem; Mutation; Carbon Cycle; Soil Microbiology; Carbon; Soil; Ecosystem; Bacteria; Animals; Climate Change; Greenhouse Gases; Isoptera; Methane; Metagenomics; Bacteria; Metagenome; Microbiota; Uncertainty; Sphingomonas; Climate Change; California; Soil Microbiology; Ecosystem; Phylogeny; Microbiota; Metagenomics; Grassland; Ecosystem; Soil Microbiology; Soil; Carbon; Climate; Introduced Species; Ecosystem; Droughts; Wildfires; Plants; Water; Biomass; Ecosystem; Australia; Forests; Trees; Wood; Carbon; Tropical Climate; Life History Traits; Soil; Soil Microbiology; Ecosystem; Bacteria; Carbon; Drought Resistance; Soil; Soil Microbiology; Droughts; Plants; Ecosystem; Ecosystem; Soil; Soil Microbiology; Nitrogen"
"Arora, Kavita",prof,research,"Arora, K","Arora, K[Author]","Arora, K[Author] AND Irvine[Affiliation]",[],
"Atwood, Scott",assoc prof,research,"Atwood, Scott","Atwood, Scott[Author]","Atwood, Scott[Author] AND Irvine[Affiliation]","['40319033', '39536613', '39463971', '39294560', '38385917', '37715952', '37205445', '37195865', '36993765', '36690742', '36383486', '35831023', '35687691', '35416650']","Humans; Cell Proliferation; Keratinocytes; Membrane Proteins; Stem Cells; Intercellular Signaling Peptides and Proteins; Secretome; Epidermis; Wnt Signaling Pathway; CRISPR-Cas Systems; Epidermal Cells; Clustered Regularly Interspaced Short Palindromic Repeats; Humans; Skin; Tissue Engineering; Organoids; Pluripotent Stem Cells; Bioprinting; Microphysiological Systems; Single-Cell Analysis; Humans; Sequence Analysis, RNA; Transcriptome; Algorithms; Gene Expression Profiling; Gene Regulatory Networks; Humans; Skin Neoplasms; Carcinoma, Basosquamous; Male; Female; Multiomics; Sebaceous Glands; Cell Differentiation; Skin; Hair Follicle; Epithelial Cells; Humans; Transcriptome; Skin; Keratinocytes; Epidermis; Cell Differentiation; Organoids; Humans; Transcriptome; Cell Communication; Gene Expression Profiling; Signal Transduction; Computer Simulation; Single-Cell Analysis; Animals; Mice; Humans; RNA; Chromatography, Liquid; Tandem Mass Spectrometry; Gene Expression Profiling; Animals; Binding Sites; Cells, Cultured; Conserved Sequence; Hedgehog Proteins; Humans; MAP Kinase Signaling System; Mitogen-Activated Protein Kinase 1; Mutation; Neoplasms; Phosphorylation; Protein Binding; Repressor Proteins; Zinc Finger Protein GLI1; Animals; Carcinoma, Basal Cell; Ecosystem; Hedgehog Proteins; Humans; Mice; Single-Cell Analysis; Skin Neoplasms; Tumor Microenvironment; Neoplasms; Nucleosides; RNA"
"Azizi, Emanuel",prof,research,"Azizi, Emanuel","Azizi, Emanuel[Author]","Azizi, Emanuel[Author] AND Irvine[Affiliation]","['38873800', '38353270', '38290561', '38176106', '37930362', '37727106', '36854379', '36576050']","Animals; Galliformes; Muscle, Skeletal; Biomechanical Phenomena; Running; Electromyography; Walking; Muscle Contraction; Isometric Contraction; Rats; Animals; Muscle, Skeletal; Tendons; Connective Tissue; Locomotion; Hindlimb; Muscle Contraction; Biomechanical Phenomena; Conservation of Energy Resources; Tendons; Muscle, Skeletal; Elasticity; Elastomers; Stress, Mechanical; Viscosity; Muscle, Skeletal; Muscle Fibers, Skeletal; Muscle Contraction; Animals; Alligators and Crocodiles; Locomotion; Walking; Gait; Extremities; Hindlimb; Biomechanical Phenomena; Animals; Temperature; Muscle Contraction; Biomechanical Phenomena; Muscle, Skeletal; Lower Extremity; Anura; Animals; Robotics; Environment; Poaceae; Trees; Animals; Muscle Spindles; Lower Extremity; Forelimb; Hindlimb; Bufo marinus"
"Baker, Nicholas",prof,research,"Baker, Nicholas E","Baker, Nicholas[Author]","Baker, Nicholas[Author] AND (Irvine[Affiliation] OR Einstein[Affiliation])","['39564985', '39131389', '39041866', '38214693', '37862174', '37272618', '37267156', '36444717', '36278853', '35179490']","Animals; Drosophila Proteins; Receptors, Notch; Caspases; Signal Transduction; Eye; Drosophila melanogaster; Drosophila; Gene Expression Regulation, Developmental; Photoreceptor Cells, Invertebrate; Repressor Proteins; Basic Helix-Loop-Helix Transcription Factors; Animals; Basic Helix-Loop-Helix Transcription Factors; DNA-Binding Proteins; Drosophila; Drosophila melanogaster; Drosophila Proteins; Eye; Gene Expression Regulation, Developmental; Mutation; Protein Binding; Receptors, Notch; Repressor Proteins; Shelterin Complex; Signal Transduction; Telomere-Binding Proteins; Transcription Factors; Mice; Animals; Wnt1 Protein; Drosophila Proteins; Proto-Oncogene Proteins; Drosophila; Oncogenes; Gene Expression Regulation, Developmental; Animals; Drosophila; Imaginal Discs; Larva; Puromycin; Animals; Mice; Anemia, Diamond-Blackfan; Erythropoiesis; Genes, Essential; Haploinsufficiency; Hematopoietic Stem Cells; Mice, Knockout; Pancytopenia; Ribosomal Proteins; Humans; Animals; Ribosomal Proteins; Tumor Suppressor Protein p53; Cell Competition; Mutation; Drosophila; Mammals; DNA-Binding Proteins; Drosophila Proteins; Humans; Animals; Mice; Cell Competition; Anemia, Diamond-Blackfan; Tumor Suppressor Protein p53; Ribosomes; Aneuploidy; Ribosomal Proteins; Drosophila; Mammals; Animals; Transcription Factors; Cell Competition; DNA-Binding Proteins; Ubiquitin-Protein Ligases; Carrier Proteins; Cullin Proteins; Drosophila; Drosophila Proteins; Animals; Cell Competition; DNA-Binding Proteins; Drosophila Proteins; Drosophila melanogaster; Eukaryotic Initiation Factor-2; Phosphorylation; Protein Biosynthesis; Ribosomes; Transcription Factors"
"Bardwell, Lee",prof,research,"Bardwell, Lee","Bardwell, Lee[Author]","Bardwell, Lee[Author] AND Irvine[Affiliation]","['39105756', '37945169', '37145016', '35831023', '35027733']","Animals; Caenorhabditis elegans; Caenorhabditis elegans Proteins; CDC2 Protein Kinase; Cdc20 Proteins; Cyclin B; Cyclin B1; Cyclin B2; Embryo, Nonmammalian; Mitosis; Phosphorylation; Animals; Humans; Saccharomyces cerevisiae; Mitogen-Activated Protein Kinases; Signal Transduction; Phosphorylation; Protein Kinases; Mammals; Animals; Binding Sites; Cells, Cultured; Conserved Sequence; Hedgehog Proteins; Humans; MAP Kinase Signaling System; Mitogen-Activated Protein Kinase 1; Mutation; Neoplasms; Phosphorylation; Protein Binding; Repressor Proteins; Zinc Finger Protein GLI1; Cadmium; Cell Line, Tumor; DNA-Binding Proteins; Gene Expression Regulation; HEK293 Cells; HeLa Cells; Hippo Signaling Pathway; Homeostasis; Humans; Inactivation, Metabolic; Phosphorylation; Protein Serine-Threonine Kinases; Stress, Physiological; Transcription Factors; Transcription, Genetic; Tumor Suppressor Proteins; Zinc; Transcription Factor MTF-1"
"Blumberg, Bruce",prof,research,"Blumberg, Bruce","Blumberg, Bruce[Author]","Blumberg, Bruce[Author] AND Irvine[Affiliation]","['40179257', '39613954', '39502475', '38546853', '38077066', '38052962', '37361542', '37230767', '37230178', '36750942', '36740725', '35716579', '35714447', '35395240', '35393121', '35208169', '35026188', '34975759']","Animals; Trialkyltin Compounds; Female; Male; Pregnancy; Prenatal Exposure Delayed Effects; Obesity; Mice; Diet, Western; Diet, High-Fat; Insulin Resistance; Endocrine Disruptors; Mice, Inbred C57BL; Leptin; Humans; Animals; Metabolic Diseases; Endocrine Disruptors; Consensus; Energy Metabolism; Humans; Obesity; Child; Pregnancy; Female; Humans; Adolescent; Child, Preschool; Endocrine Disruptors; Autism Spectrum Disorder; Prenatal Exposure Delayed Effects; Autistic Disorder; Pesticides; Epidemiologic Studies; Male; Mice; Animals; Pregnane X Receptor; Receptors, Steroid; Xenobiotics; Obesity; Adipocytes; Insulin Resistance; Diet, High-Fat; Humans; Environmental Exposure; Endocrine Disruptors; Obesity; Weight Gain; Pandemics; Humans; Adipogenesis; Retinoid X Receptors; PPAR gamma; Mesenchymal Stem Cells; Lipids; Female; Pregnancy; Male; Animals; Mice; Adipogenesis; Rosiglitazone; PPAR gamma; Mesenchymal Stem Cells; Cell Differentiation; Obesity; MicroRNAs; Adipogenesis; Adipose Tissue; Child, Preschool; Endocrine Disruptors; Environmental Exposure; Humans; Obesity; 3T3-L1 Cells; Adipocytes; Adipogenesis; Animals; Caenorhabditis elegans; Cell Differentiation; Mice; Obesity; Zebrafish; Adipogenesis; Animals; Benzamides; Cannabidiol; Cell Line, Transformed; Humans; Lipogenesis; Lipolysis; Mesenchymal Stem Cells; Mice; PPAR gamma; Pyridines; Animals; Chromatin; DNA Methylation; Endocrine Disruptors; Environmental Exposure; Epigenesis, Genetic; Female; Genetic Predisposition to Disease; Histones; Humans; Inheritance Patterns; Male; Methylation; Obesity; Phenotype"
"Blurton-Jones, Mathew",prof,research,"Blurton-Jones, Mathew","Blurton-Jones, Mathew[Author]","Blurton-Jones, Mathew[Author] AND Irvine[Affiliation]","['40233761', '40205047', '40074745', '39813317', '39612244', '39142282', '39018376', '38970922', '38961225', '38897209', '38897208', '38523285', '38519640', '38482922', '38293075', '38115077', '37957324', '37582369', '37543250', '37537168']","Animals; Microglia; Disease Models, Animal; Xenon; Amyloidosis; Administration, Inhalation; Mice; Tauopathies; Mice, Transgenic; Alzheimer Disease; Plaque, Amyloid; Mice, Inbred C57BL; Humans; Humans; Induced Pluripotent Stem Cells; Microglia; Alzheimer Disease; tau Proteins; Neurons; Amyloid beta-Peptides; Phagocytosis; Presenilin-1; Ferroptosis; Lipid Peroxidation; Organoids; Coculture Techniques; Microglia; Blood-Brain Barrier; Animals; Cholesterol; Endothelial Cells; Mice; Brain; Receptors, Granulocyte-Macrophage Colony-Stimulating Factor; Mice, Inbred C57BL; Male; Organic Chemicals; Microglia; Complement C1q; Humans; Phenotype; Induced Pluripotent Stem Cells; Organelles; Mitochondria; Microscopy; Cells, Cultured; Humans; Microglia; Induced Pluripotent Stem Cells; Calcium Signaling; Cell Movement; Endoplasmic Reticulum; Calcium; Cyclic AMP; Chemotaxis; Aged; Animals; Female; Humans; Male; Mice; Alzheimer Disease; Apolipoprotein E4; Brain; Cognitive Dysfunction; Disease Models, Animal; Interleukin-17; Mice, Transgenic; Microglia; Neutrophils; Plaque, Amyloid; Sex Factors; Animals; Microglia; Leukoencephalopathies; Humans; Mice; Disease Models, Animal; Induced Pluripotent Stem Cells; Receptors, Granulocyte-Macrophage Colony-Stimulating Factor; Gliosis; Receptor, Macrophage Colony-Stimulating Factor; Microglia; Animals; Mice; Aging; Receptors, Granulocyte-Macrophage Colony-Stimulating Factor; Brain; Mice, Inbred C57BL; Male; White Matter; Leukoencephalopathies; Thalamus; Humans; Microglia; Schizophrenia; Male; Female; Twins, Monozygotic; Adult; Induced Pluripotent Stem Cells; Interleukin-1beta; Sulfoxides; Inflammation; Middle Aged; Isothiocyanates; Alzheimer Disease; Animals; NF-E2-Related Factor 2; Microglia; Humans; Mice; Interferon-gamma; Disease Models, Animal; Oxidative Stress; Mice, Transgenic; Humans; Animals; Mice; Apolipoprotein E4; Microglia; Apolipoprotein E3; Alzheimer Disease; Apolipoproteins E; Mice, Transgenic; Mice; Animals; Humans; Female; Microglia; Breast Neoplasms; Brain Neoplasms; Brain; Treatment Outcome; Humans; Mice; Animals; Microglia; Gene Regulatory Networks; Brain; Induced Pluripotent Stem Cells; Gene Expression Regulation; Humans; Frontotemporal Dementia; Induced Pluripotent Stem Cells; Microglia; Endosomal Sorting Complexes Required for Transport; Humans; Neuroinflammatory Diseases; Inflammation; Brain; Brain Injuries, Traumatic; Contusions; Mitochondria; Microglia; Astrocytes"
"Bracken, Matthew",prof,research,"Bracken, Matthew","Bracken, Matthew[Author]","Bracken, Matthew[Author] AND Irvine[Affiliation]","['39358884', '38912782', '38703050', '37546568', '37260224', '35039551']",Animals; Biomass; Food Chain; Mollusca; Macrocystis; Kelp; Conservation of Natural Resources; Urea; Nitrates; Ammonium Compounds; Nitrogen; California; Kelp; Macrocystis; Seawater; Ecosystem; Carbon Dioxide; Alaska; Oxygen; Hydrogen-Ion Concentration
"Briscoe, Adriana",prof,research,"Briscoe, Adriana","Briscoe, Adriana[Author]","Briscoe, Adriana[Author] AND Irvine[Affiliation]","['39915690', '38513043', '37552755', '36058243', '35348742']","Animals; Butterflies; Biological Mimicry; Pigmentation; Color Vision; Wings, Animal; Male; Female; Sexual Behavior, Animal; Color; Animals; Male; Mating Preference, Animal; Butterflies; Reproduction; Animals; Female; Color Vision; Butterflies; Eye; Opsins; Rhodopsin; Animals; Drosophila melanogaster; Evolution, Molecular; Insecta; Opsins; Phylogeny; Animals; Butterflies; Color Vision; Female; Opsins; Photoreceptor Cells; Wings, Animal"
"Burley, Nancy",prof,research,"Burley, Nancy","Burley, Nancy[Author]","Burley, Nancy[Author] AND Irvine[Affiliation]",[],
"Busciglio, Jorge",prof,research,"Busciglio, Jorge","Busciglio, Jorge[Author]","Busciglio, Jorge[Author] AND Irvine[Affiliation]","['40257051', '39756004', '37064334', '37021589', '36742045']",Humans; Down Syndrome; Alzheimer Disease; Extracellular Vesicles; Male; Female; Biomarkers; Middle Aged; Neurons; Adult; tau Proteins; Nerve Growth Factor; Aged; Tetraspanin 28; Protein Precursors; Down Syndrome; Humans; Animals; Female; Adult; Quality of Life; Child; Biomedical Research; Humans; Adult; Alzheimer Disease; Down Syndrome; Basal Forebrain; Atrophy; Biomarkers
"Cahill, Larry",prof,research,"Cahill, Larry","Cahill, Larry[Author]","Cahill, Larry[Author] AND Irvine[Affiliation]",['36349596'],"Female; Humans; Male; Oxytocin; Memory, Episodic; Sex Characteristics; Estradiol; Emotions; Administration, Intranasal; Magnetic Resonance Imaging; Double-Blind Method"
"Cho, Ken",prof,research,"Cho, Ken","Cho, Ken[Author]","Cho, Ken[Author] AND Irvine[Affiliation]","['39829826', '39550025', '37423592', '36971347', '36168140', '35848281', '35172134', '35027733']","Animals; Chromatin; Zygote; Histones; Gene Expression Regulation, Developmental; Xenopus laevis; Xenopus Proteins; Germ Layers; Transcription Factors; Endoderm; Female; Epigenesis, Genetic; Gastrula; Lysine; N-Myc Proto-Oncogene Protein; Gene Regulatory Networks; Endoderm; Cell Differentiation; Transcription Factors; Gene Expression Regulation, Developmental; Histones; Histone Deacetylase 1; Chromatin; Blastocyst; Histone Deacetylases; Embryonic Development; Acetylation; Histone Deacetylase 2; Animals; Xenopus laevis; Epigenomics; Chromatin; Embryonic Development; Zygote; Gene Expression Regulation, Developmental; Animals; Chromatin; Forkhead Transcription Factors; Gene Expression Regulation, Developmental; Mice; Proteomics; Xenopus Proteins; Xenopus laevis; Animals; Chromatin; Consensus Sequence; DNA; Endoderm; Gastrulation; Gene Expression Regulation, Developmental; Gene Regulatory Networks; Genomics; Mesoderm; Protein Binding; RNA; Transcription Factors; Transcription, Genetic; Xenopus; Cadmium; Cell Line, Tumor; DNA-Binding Proteins; Gene Expression Regulation; HEK293 Cells; HeLa Cells; Hippo Signaling Pathway; Homeostasis; Humans; Inactivation, Metabolic; Phosphorylation; Protein Serine-Threonine Kinases; Stress, Physiological; Transcription Factors; Transcription, Genetic; Tumor Suppressor Proteins; Zinc; Transcription Factor MTF-1"
"Chrastil, Elizabeth",assoc prof,research,"Chrastil, Elizabeth","Chrastil, Elizabeth[Author]","Chrastil, Elizabeth[Author] AND Irvine[Affiliation]","['40262422', '39566126', '39284962', '38919601', '38587934', '38190546', '36460006', '36322732', '35995375']",Humans; Male; Hippocampus; Female; Spatial Navigation; Young Adult; Adult; Magnetic Resonance Imaging; Maze Learning; Adolescent; Organ Size; Spatial Memory; Humans; Female; Pregnancy; Brain; Adult; Magnetic Resonance Imaging; Gray Matter; White Matter; Humans; Figural Aftereffect; Motion; Motion Perception; Spatial Memory; Spatial Learning; Gyrus Cinguli; Cognition; Cerebral Cortex; Spatial Navigation; Animals; Humans; Brain; Temporal Lobe; Neurons; Head; Hippocampus; Humans; Maze Learning; Memory; Spatial Navigation; Theta Rhythm
"Cinquin, Olivier",assoc prof,research,"Cinquin, Olivier","Cinquin, Olivier[Author]","Cinquin, Olivier[Author] AND Irvine[Affiliation]","['39910777', '38314912']","Computational Biology; Programming Languages; Software; Databases, Factual; Genomics; Humans; Large Language Models; Generative Artificial Intelligence; Humans; Medicine; Cell Line; Chromatin Immunoprecipitation; Databases, Factual; Language"
"Cocco, Melanie",assoc prof,research,"Cocco, Melanie","Cocco, Melanie[Author]","Cocco, Melanie[Author] AND Irvine[Affiliation]","['39467204', '38745908']",Basic Helix-Loop-Helix Transcription Factors; Ligands; Kinetics; Humans; Molecular Dynamics Simulation; Protein Binding
"Cohen-Cory, Susana",prof,research,"Cohen-Cory, Susana","Cohen-Cory, Susana[Author]","Cohen-Cory, Susana[Author] AND Irvine[Affiliation]","['37252636', '35422013']",Animals; Axons; Cell Adhesion Molecules; Retina; Superior Colliculi; Visual Pathways; Xenopus Proteins; Xenopus laevis
"Connor, Kwasi",asst prof,research,"Connor, Kwasi","Connor, Kwasi[Author]","Connor, Kwasi[Author] AND Irvine[Affiliation]","['38857883', '36572236']",Animals; Mytilus; Amylases; Hot Temperature; Cellulase; Heat-Shock Response; Acclimatization; Diet; Animals; Mytilus; Temperature; Heat-Shock Response; Cold Temperature; Acclimatization
"Cramer, Karina",prof,research,"Cramer, Karina","Cramer, Karina[Author]","Cramer, Karina[Author] AND Irvine[Affiliation]","['39416682', '38189925', '36323869', '35330912', '35221938']","Animals; RNA, Long Noncoding; Phylogeny; Gene Expression Regulation; Biological Evolution; Mammals; Animals; Mice; Microglia; Brain Stem; Trapezoid Body; Hearing; Synapses"
"Daley, Monica",prof,research,"Daley, Monica","Daley, Monica[Author]","Daley, Monica[Author] AND Irvine[Affiliation]","['39665282', '39633193', '39445492', '39021771', '38873800', '38290561', '38059428', '37565347', '37334740', '37282982', '37086033', '35924117', '35294220', '35042414']","Animals; Air; Biomechanical Phenomena; Birds; Extremities; Flight, Animal; Gait; Locomotion; Robotics; Wings, Animal; Walking; Aircraft; Biomimetics; Motion; Animals; Muscle, Skeletal; Rats; Biomechanical Phenomena; Male; Electromyography; Locomotion; Rats, Sprague-Dawley; Muscle Contraction; Avatar; Animals; Galliformes; Muscle, Skeletal; Biomechanical Phenomena; Running; Electromyography; Walking; Muscle Contraction; Isometric Contraction; Conservation of Energy Resources; Tendons; Muscle, Skeletal; Elasticity; Elastomers; Stress, Mechanical; Viscosity; Animals; Genomics; Environment; Animals; Feedback; Robotics; Robotic Surgical Procedures; Locomotion; Spinal Cord; Vertebrates; Mice; Animals; Biomechanical Phenomena; Locomotion; Muscle, Skeletal; Running; Galliformes; Muscle Contraction; Animals; Biomechanical Phenomena; Walking; Muscle, Skeletal; Gait; Galliformes; Biomechanical Phenomena; History, 20th Century; History, 21st Century; Animals; Biomechanical Phenomena; Birds; Gait; Leg; Locomotion; Robotics; Animals; Biology; Biomechanical Phenomena; Locomotion; Movement; Robotics"
"Donovan, Peter",prof,research,"Donovan, Peter","Donovan, Peter[Author]","Donovan, Peter[Author] AND Irvine[Affiliation]",['38629187'],Humans; Chromatin; Transcription Factor 7-Like 1 Protein; Human Embryonic Stem Cells; Protein Binding; Wnt Signaling Pathway; Cell Line
"Drayman, Nir",asst prof,research,"Drayman, Nir","Drayman, Nir[Author]","Drayman, Nir[Author] AND Irvine[Affiliation]","['40044688', '39814710', '39287456', '38168299', '38008398', '37991369', '37747254', '36217030']","Virus Replication; Humans; Genome, Viral; Herpesvirus 1, Human; Homeodomain Proteins; Zygote; Gene Expression Regulation, Viral; Herpesviridae; Animals; CRISPR-Cas Systems; Transcription, Genetic; HEK293 Cells; Herpesvirus 1, Human; Antiviral Agents; Humans; Decitabine; Drug Repositioning; Acyclovir; Herpes Simplex; Animals; Drug Synergism; Virus Replication; Drug Resistance, Viral; Chlorocebus aethiops; Vero Cells; Keratinocytes; Cell Line; Single-Cell Analysis; Humans; Virus Diseases; COVID-19; SARS-CoV-2; Animals; Sequence Analysis, RNA; Viruses; DNA, Viral; Genome, Viral; Herpesvirus 1, Human; Mutation; Virus Replication; Eukaryotic Cells; Cell Nucleus; Serial Passage; Humans; Humans; Herpesvirus 1, Human; Virus Diseases; Orthomyxoviridae; Humans; Cell Line; COVID-19; Gene Expression Regulation; SARS-CoV-2; Viral Proteins; Protein Interaction Mapping"
"Edinger, Aimee",prof,research,"Edinger, Aimee","Edinger, Aimee[Author]","Edinger, Aimee[Author] AND Irvine[Affiliation]","['39602282', '39027368', '38735134', '37779389', '37693406', '37022133', '36727438']","Pinocytosis; Humans; Autophagy; Cell Line, Tumor; Sodium-Hydrogen Exchangers; Amiloride; Cell Proliferation; CRISPR-Cas Systems; Vacuoles; Endosomes; Humans; Phosphatidylinositols; Animals; PTEN Phosphohydrolase; Phosphatidylinositol 3-Kinases; Class III Phosphatidylinositol 3-Kinases; Mice; Morpholines; Vacuolar Proton-Translocating ATPases; Cytoplasm; HeLa Cells; Aminopyridines; Heterocyclic Compounds, 3-Ring; Humans; Minority Groups; Cultural Diversity; Faculty; Students; Schools; Animals; Mice; Humans; Kidney Glomerulus; Podocytes; Endosomes; Drosophila; Kidney; Mammals; Animals; Mice; Oligonucleotides; Endosomes; Endocytosis; Biological Transport; Oligonucleotides, Antisense; RNA, Small Interfering"
"Emerson, J.J.",assoc prof,research,"Emerson, JJ","Emerson, JJ[Author]","Emerson, JJ[Author] AND Irvine[Affiliation] OR 0000-0001-9474-0891[Author - Identifier]","['39990489', '39975360', '39920270', '39875578', '39693425', '38915508', '37552755', '37494033', '35710823', '35501892']","Evolution, Molecular; Selection, Genetic; Animals; Gene Regulatory Networks; Humans; Mutation; Gene Duplication; Phenotype; Plants; Animals; Enhancer Elements, Genetic; Evolution, Molecular; Drosophila melanogaster; Drosophila Proteins; Genes, Duplicate; Gene Duplication; Genome, Insect; Animals; Female; Color Vision; Butterflies; Eye; Opsins; Rhodopsin; Genome-Wide Association Study; Gene Frequency; Genomics; Software; High-Throughput Nucleotide Sequencing; Animals; Chromatin; Chromatin Assembly and Disassembly; Genome; Heterochromatin; Mammals; Molecular Conformation"
"Eom, Dae Seok",asst prof,research,"Eom, Dae Seok","Eom, Dae Seok[Author]","Eom, Dae Seok[Author] AND Irvine[Affiliation]","['39242378', '38463999', '37454294', '35467525', '35355366']",Animals; Cell Communication; Humans; Zebrafish; Signal Transduction; Animals; Zebrafish; Matrix Metalloproteinase 9; Macrophages; Cell Communication; Signal Transduction; Animals; Cell Surface Extensions; Diffusion; Zebrafish; Animals; Drosophila; Drosophila Proteins; Endoderm; Muscles; Zebrafish
"Faiola, Celia",assoc prof,research,"Faiola, Celia","Faiola, Celia[Author]","Faiola, Celia[Author] AND Irvine[Affiliation]","['39018113', '38812434', '38669108', '38371653', '37223424']","Aerosols; Oxidation-Reduction; Volatile Organic Compounds; Air Pollutants; Terpenes; Acyclic Monoterpenes; Models, Chemical; Photochemical Processes; Atmosphere; Bicyclic Monoterpenes; Monoterpenes; Environmental Monitoring; Ozone; Sesquiterpenes; Atmosphere; Air Pollutants; Isomerism"
"Fortin, Norbert",prof,research,"Fortin, Norbert","Fortin, Norbert[Author]","Fortin, Norbert[Author] AND Irvine[Affiliation]","['40282562', '40270583', '35781923', '35532116', '35136052']","Animals; CA1 Region, Hippocampal; Cognition; Hippocampus; Memory; Odorants; Rats; Theta Rhythm; Acoustic Stimulation; Animals; Auditory Perception; Electrodes, Implanted; Hippocampus; Machine Learning; Male; Memory; Models, Animal; Nerve Net; Odorants; Olfactory Perception; Rats; Stereotaxic Techniques; Time Factors"
